url,shortDescription
hostels-in-village-hajipurda,"<p>Opting for accommodation in village's HOSTELS facilities proves advantageous for residents of Hajipurda. The HOSTELS in village stand out as a favorable choice for those seeking housing in Hajipurda due to its positive attributes. Residents in Hajipurda find the HOSTELS in village to be a commendable option for their accommodation needs. Offering single, double, and triple sharing rooms, premium accommodations by Zolo also provide an array of services which are inclusive of homely meals, daily housekeeping, WiFi, DTH, and much more. We have single, double, and private occupancy hostels in village, <a href='https://zolostays.com/pgs-in-hajipurda' rel='noopener noreferrer' target='_blank' style='color: var(--intergalactic-text-link, #006dca);'>Hajipurda</a>, And what's more, it acts as a savior for men/women working/studying in and around top-notch IT companies. Hurry Book your stay today!</p><p>Are you looking for the best hostels in village Hajipurda? Embarking on this task can be challenging as it requires careful consideration of factors such as budget and other essential aspects to find your ideal living space. Gone are the days when you needed a broker to search for a house. </p><p>In today's era, finding a suitable living space has become easier with platforms like Zolostays. Whether you're looking for a coliving hostels in village or any other area, Zolo has got you covered.</p><p>When searching for a <a href='https://zolostays.com/women-pgs-in-hajipurda' rel='noopener noreferrer' target='_blank' style='color: var(--intergalactic-text-link, #006dca);'>hostels for ladies</a> in village, the priorities that come to mind are safety and comfort. Ensuring a secure and welcoming environment for female residents is of utmost importance in these accommodations. On the other hand, when it comes to a luxury <a href='https://zolostays.com/men-pgs-in-hajipurda' rel='noopener noreferrer' target='_blank' style='color: var(--intergalactic-text-link, #006dca);'>hostels for gents</a> in village Hajipurda, the primary concern is a worry-free stay after that comfort, and sophistication come into place.&nbsp;</p><p>Zolo's accommodations are dedicated to offering male residents a hassle-free living experience. They prioritize convenience and peace of mind by providing features such as controlled access, round-the-clock security, and attentive staff members who are ready to assist.</p><p>In addition, the Luxury hostels in village surpasses ordinary expectations, elevating the living experience to new heights. Residents have access to a variety of amenities and services included in their rent, making their stay truly exceptional.</p><p>With Zolo's hassle-free hostels in village, residents can enjoy a seamless and comfortable living experience, where their needs are catered to and their concerns are taken care of. Thoughtful planning provides everything from top-notch security to luxurious amenities to enhance the overall quality of life.</p><p>Unisex hostels in village is designed to cater to the diverse needs of both students and working professionals. These accommodations create an inclusive environment where individuals from different backgrounds can coexist. Recognizing that some students may prefer an environment that is exclusively focused on their needs, there are options available that cater specifically to students. Zolo's student hostels accommodation in village is tailored to meet the requirements and preferences of students, ensuring a supportive and conducive environment for their academic pursuits.</p><p>Coliving Spaces in village embrace Community Living as it offers a unique living concept that fosters community and collaboration. Designed to bring together individuals from diverse backgrounds, these spaces create a vibrant and supportive environment.</p><p>In coliving spaces, residents have their own private rooms while sharing common areas such as kitchens, lounges, and recreational spaces.&nbsp;</p><p>In addition to the social aspect, co-living spaces prioritize the safety and well-being of their residents. They provide secure and comfortable havens for both men and women. Ladies hostels in village within these coliving spaces ensure a secure and comfortable environment exclusively designed for women, prioritizing their safety and offering a welcoming atmosphere.</p><p>For those seeking privacy and convenience, a single-room hostels in village Hajipurda is the perfect choice. These accommodations offer a dedicated living space where residents can enjoy their personal sphere without the need to share rooms or bathrooms with roommates. In <a href='https://zolostays.com/single-room-for-rent-in-hajipurda' rel='noopener noreferrer' target='_blank' style='color: var(--intergalactic-text-link, #006dca);'>single-room hostels</a>, you have the luxury of having your own private space, ensuring that you don't have to compromise or negotiate with roommates. With no roommates to consider, you can enjoy the freedom and comfort of living according to your preferences and schedule.</p>"
hostels-in-hsr-bangalore,"<p>For those in Bangalore, the HOSTELS accommodations in hsr offer a positive and advantageous choice. It's a beneficial option for people residing in the city seeking accommodation. Offering single, double, and triple sharing rooms, premium accommodations by Zolo also provide an array of services which are inclusive of homely meals, daily housekeeping, WiFi, DTH, and much more. We have single, double, and private occupancy hostels in hsr, <a href='https://zolostays.com/pgs-in-bangalore' rel='noopener noreferrer' target='_blank' style='color: var(--intergalactic-text-link, #006dca);'>Bangalore</a>, And what's more, it acts as a savior for men/women working/studying in and around top-notch IT companies. Hurry Book your stay today!</p><p>Are you looking for the best hostels in hsr Bangalore? Embarking on this task can be challenging as it requires careful consideration of factors such as budget and other essential aspects to find your ideal living space. Gone are the days when you needed a broker to search for a house. </p><p>In today's era, finding a suitable living space has become easier with platforms like Zolostays. Whether you're looking for a coliving hostels in hsr or any other area, Zolo has got you covered.</p><p>When searching for a <a href='https://zolostays.com/women-pgs-in-bangalore' rel='noopener noreferrer' target='_blank' style='color: var(--intergalactic-text-link, #006dca);'>hostels for ladies</a> in hsr, the priorities that come to mind are safety and comfort. Ensuring a secure and welcoming environment for female residents is of utmost importance in these accommodations. On the other hand, when it comes to a luxury <a href='https://zolostays.com/men-pgs-in-bangalore' rel='noopener noreferrer' target='_blank' style='color: var(--intergalactic-text-link, #006dca);'>hostels for gents</a> in hsr Bangalore, the primary concern is a worry-free stay after that comfort, and sophistication come into place.&nbsp;</p><p>Zolo's accommodations are dedicated to offering male residents a hassle-free living experience. They prioritize convenience and peace of mind by providing features such as controlled access, round-the-clock security, and attentive staff members who are ready to assist.</p><p>In addition, the Luxury hostels in hsr surpasses ordinary expectations, elevating the living experience to new heights. Residents have access to a variety of amenities and services included in their rent, making their stay truly exceptional.</p><p>With Zolo's hassle-free hostels in hsr, residents can enjoy a seamless and comfortable living experience, where their needs are catered to and their concerns are taken care of. Thoughtful planning provides everything from top-notch security to luxurious amenities to enhance the overall quality of life.</p><p>Unisex hostels in hsr is designed to cater to the diverse needs of both students and working professionals. These accommodations create an inclusive environment where individuals from different backgrounds can coexist. Recognizing that some students may prefer an environment that is exclusively focused on their needs, there are options available that cater specifically to students. Zolo's student hostels accommodation in hsr is tailored to meet the requirements and preferences of students, ensuring a supportive and conducive environment for their academic pursuits.</p><p>Coliving Spaces in hsr embrace Community Living as it offers a unique living concept that fosters community and collaboration. Designed to bring together individuals from diverse backgrounds, these spaces create a vibrant and supportive environment.</p><p>In coliving spaces, residents have their own private rooms while sharing common areas such as kitchens, lounges, and recreational spaces.&nbsp;</p><p>In addition to the social aspect, co-living spaces prioritize the safety and well-being of their residents. They provide secure and comfortable havens for both men and women. Ladies hostels in hsr within these coliving spaces ensure a secure and comfortable environment exclusively designed for women, prioritizing their safety and offering a welcoming atmosphere.</p><p>For those seeking privacy and convenience, a single-room hostels in hsr Bangalore is the perfect choice. These accommodations offer a dedicated living space where residents can enjoy their personal sphere without the need to share rooms or bathrooms with roommates. In <a href='https://zolostays.com/single-room-for-rent-in-bangalore' rel='noopener noreferrer' target='_blank' style='color: var(--intergalactic-text-link, #006dca);'>single-room hostels</a>, you have the luxury of having your own private space, ensuring that you don't have to compromise or negotiate with roommates. With no roommates to consider, you can enjoy the freedom and comfort of living according to your preferences and schedule.</p>"
hostels-in-cox_town-bangalore,"<p>HOSTELS in cox town is a good option for Bangalore people. Offering single, double, and triple sharing rooms, premium accommodations by Zolo also provide an array of services which are inclusive of homely meals, daily housekeeping, WiFi, DTH, and much more. We have single, double, and private occupancy hostels in cox town, <a href='https://zolostays.com/pgs-in-bangalore' rel='noopener noreferrer' target='_blank' style='color: var(--intergalactic-text-link, #006dca);'>Bangalore</a>, And what's more, it acts as a savior for men/women working/studying in and around top-notch IT companies. Hurry Book your stay today!</p><p>Are you looking for the best hostels in cox town Bangalore? Embarking on this task can be challenging as it requires careful consideration of factors such as budget and other essential aspects to find your ideal living space. Gone are the days when you needed a broker to search for a house. </p><p>In today's era, finding a suitable living space has become easier with platforms like Zolostays. Whether you're looking for a coliving hostels in cox town or any other area, Zolo has got you covered.</p><p>When searching for a <a href='https://zolostays.com/women-pgs-in-bangalore' rel='noopener noreferrer' target='_blank' style='color: var(--intergalactic-text-link, #006dca);'>hostels for ladies</a> in cox town, the priorities that come to mind are safety and comfort. Ensuring a secure and welcoming environment for female residents is of utmost importance in these accommodations. On the other hand, when it comes to a luxury <a href='https://zolostays.com/men-pgs-in-bangalore' rel='noopener noreferrer' target='_blank' style='color: var(--intergalactic-text-link, #006dca);'>hostels for gents</a> in cox town Bangalore, the primary concern is a worry-free stay after that comfort, and sophistication come into place.&nbsp;</p><p>Zolo's accommodations are dedicated to offering male residents a hassle-free living experience. They prioritize convenience and peace of mind by providing features such as controlled access, round-the-clock security, and attentive staff members who are ready to assist.</p><p>In addition, the Luxury hostels in cox town surpasses ordinary expectations, elevating the living experience to new heights. Residents have access to a variety of amenities and services included in their rent, making their stay truly exceptional.</p><p>With Zolo's hassle-free hostels in cox town, residents can enjoy a seamless and comfortable living experience, where their needs are catered to and their concerns are taken care of. Thoughtful planning provides everything from top-notch security to luxurious amenities to enhance the overall quality of life.</p><p>Unisex hostels in cox town is designed to cater to the diverse needs of both students and working professionals. These accommodations create an inclusive environment where individuals from different backgrounds can coexist. Recognizing that some students may prefer an environment that is exclusively focused on their needs, there are options available that cater specifically to students. Zolo's student hostels accommodation in cox town is tailored to meet the requirements and preferences of students, ensuring a supportive and conducive environment for their academic pursuits.</p><p>Coliving Spaces in cox town embrace Community Living as it offers a unique living concept that fosters community and collaboration. Designed to bring together individuals from diverse backgrounds, these spaces create a vibrant and supportive environment.</p><p>In coliving spaces, residents have their own private rooms while sharing common areas such as kitchens, lounges, and recreational spaces.&nbsp;</p><p>In addition to the social aspect, co-living spaces prioritize the safety and well-being of their residents. They provide secure and comfortable havens for both men and women. Ladies hostels in cox town within these coliving spaces ensure a secure and comfortable environment exclusively designed for women, prioritizing their safety and offering a welcoming atmosphere.</p><p>For those seeking privacy and convenience, a single-room hostels in cox town Bangalore is the perfect choice. These accommodations offer a dedicated living space where residents can enjoy their personal sphere without the need to share rooms or bathrooms with roommates. In <a href='https://zolostays.com/single-room-for-rent-in-bangalore' rel='noopener noreferrer' target='_blank' style='color: var(--intergalactic-text-link, #006dca);'>single-room hostels</a>, you have the luxury of having your own private space, ensuring that you don't have to compromise or negotiate with roommates. With no roommates to consider, you can enjoy the freedom and comfort of living according to your preferences and schedule.</p>"
hostels-in-bhandup_west-mumbai,"<p>For those in Mumbai, the HOSTELS accommodations in bhandup west offer a positive and advantageous choice. It's a beneficial option for people residing in the city seeking accommodation. Offering single, double, and triple sharing rooms, premium accommodations by Zolo also provide an array of services which are inclusive of homely meals, daily housekeeping, WiFi, DTH, and much more. We have single, double, and private occupancy hostels in bhandup west, <a href='https://zolostays.com/pgs-in-mumbai' rel='noopener noreferrer' target='_blank' style='color: var(--intergalactic-text-link, #006dca);'>Mumbai</a>, And what's more, it acts as a savior for men/women working/studying in and around top-notch IT companies. Hurry Book your stay today!</p><p>Are you looking for the best hostels in bhandup west Mumbai? Embarking on this task can be challenging as it requires careful consideration of factors such as budget and other essential aspects to find your ideal living space. Gone are the days when you needed a broker to search for a house. </p><p>In today's era, finding a suitable living space has become easier with platforms like Zolostays. Whether you're looking for a coliving hostels in bhandup west or any other area, Zolo has got you covered.</p><p>When searching for a <a href='https://zolostays.com/women-pgs-in-mumbai' rel='noopener noreferrer' target='_blank' style='color: var(--intergalactic-text-link, #006dca);'>hostels for ladies</a> in bhandup west, the priorities that come to mind are safety and comfort. Ensuring a secure and welcoming environment for female residents is of utmost importance in these accommodations. On the other hand, when it comes to a luxury <a href='https://zolostays.com/men-pgs-in-mumbai' rel='noopener noreferrer' target='_blank' style='color: var(--intergalactic-text-link, #006dca);'>hostels for gents</a> in bhandup west Mumbai, the primary concern is a worry-free stay after that comfort, and sophistication come into place.&nbsp;</p><p>Zolo's accommodations are dedicated to offering male residents a hassle-free living experience. They prioritize convenience and peace of mind by providing features such as controlled access, round-the-clock security, and attentive staff members who are ready to assist.</p><p>In addition, the Luxury hostels in bhandup west surpasses ordinary expectations, elevating the living experience to new heights. Residents have access to a variety of amenities and services included in their rent, making their stay truly exceptional.</p><p>With Zolo's hassle-free hostels in bhandup west, residents can enjoy a seamless and comfortable living experience, where their needs are catered to and their concerns are taken care of. Thoughtful planning provides everything from top-notch security to luxurious amenities to enhance the overall quality of life.</p><p>Unisex hostels in bhandup west is designed to cater to the diverse needs of both students and working professionals. These accommodations create an inclusive environment where individuals from different backgrounds can coexist. Recognizing that some students may prefer an environment that is exclusively focused on their needs, there are options available that cater specifically to students. Zolo's student hostels accommodation in bhandup west is tailored to meet the requirements and preferences of students, ensuring a supportive and conducive environment for their academic pursuits.</p><p>Coliving Spaces in bhandup west embrace Community Living as it offers a unique living concept that fosters community and collaboration. Designed to bring together individuals from diverse backgrounds, these spaces create a vibrant and supportive environment.</p><p>In coliving spaces, residents have their own private rooms while sharing common areas such as kitchens, lounges, and recreational spaces.&nbsp;</p><p>In addition to the social aspect, co-living spaces prioritize the safety and well-being of their residents. They provide secure and comfortable havens for both men and women. Ladies hostels in bhandup west within these coliving spaces ensure a secure and comfortable environment exclusively designed for women, prioritizing their safety and offering a welcoming atmosphere.</p><p>For those seeking privacy and convenience, a single-room hostels in bhandup west Mumbai is the perfect choice. These accommodations offer a dedicated living space where residents can enjoy their personal sphere without the need to share rooms or bathrooms with roommates. In <a href='https://zolostays.com/single-room-for-rent-in-mumbai' rel='noopener noreferrer' target='_blank' style='color: var(--intergalactic-text-link, #006dca);'>single-room hostels</a>, you have the luxury of having your own private space, ensuring that you don't have to compromise or negotiate with roommates. With no roommates to consider, you can enjoy the freedom and comfort of living according to your preferences and schedule.</p>"
hostels-in-cv_ramanagarar-bangalore,"<p>HOSTELS in cv ramanagarar is a good option for Bangalore people. Offering single, double, and triple sharing rooms, premium accommodations by Zolo also provide an array of services which are inclusive of homely meals, daily housekeeping, WiFi, DTH, and much more. We have single, double, and private occupancy hostels in cv ramanagarar, <a href='https://zolostays.com/pgs-in-bangalore' rel='noopener noreferrer' target='_blank' style='color: var(--intergalactic-text-link, #006dca);'>Bangalore</a>, And what's more, it acts as a savior for men/women working/studying in and around top-notch IT companies. Hurry Book your stay today!</p><p>Are you looking for the best hostels in cv ramanagarar Bangalore? Embarking on this task can be challenging as it requires careful consideration of factors such as budget and other essential aspects to find your ideal living space. Gone are the days when you needed a broker to search for a house. </p><p>In today's era, finding a suitable living space has become easier with platforms like Zolostays. Whether you're looking for a coliving hostels in cv ramanagarar or any other area, Zolo has got you covered.</p><p>When searching for a <a href='https://zolostays.com/women-pgs-in-bangalore' rel='noopener noreferrer' target='_blank' style='color: var(--intergalactic-text-link, #006dca);'>hostels for ladies</a> in cv ramanagarar, the priorities that come to mind are safety and comfort. Ensuring a secure and welcoming environment for female residents is of utmost importance in these accommodations. On the other hand, when it comes to a luxury <a href='https://zolostays.com/men-pgs-in-bangalore' rel='noopener noreferrer' target='_blank' style='color: var(--intergalactic-text-link, #006dca);'>hostels for gents</a> in cv ramanagarar Bangalore, the primary concern is a worry-free stay after that comfort, and sophistication come into place.&nbsp;</p><p>Zolo's accommodations are dedicated to offering male residents a hassle-free living experience. They prioritize convenience and peace of mind by providing features such as controlled access, round-the-clock security, and attentive staff members who are ready to assist.</p><p>In addition, the Luxury hostels in cv ramanagarar surpasses ordinary expectations, elevating the living experience to new heights. Residents have access to a variety of amenities and services included in their rent, making their stay truly exceptional.</p><p>With Zolo's hassle-free hostels in cv ramanagarar, residents can enjoy a seamless and comfortable living experience, where their needs are catered to and their concerns are taken care of. Thoughtful planning provides everything from top-notch security to luxurious amenities to enhance the overall quality of life.</p><p>Unisex hostels in cv ramanagarar is designed to cater to the diverse needs of both students and working professionals. These accommodations create an inclusive environment where individuals from different backgrounds can coexist. Recognizing that some students may prefer an environment that is exclusively focused on their needs, there are options available that cater specifically to students. Zolo's student hostels accommodation in cv ramanagarar is tailored to meet the requirements and preferences of students, ensuring a supportive and conducive environment for their academic pursuits.</p><p>Coliving Spaces in cv ramanagarar embrace Community Living as it offers a unique living concept that fosters community and collaboration. Designed to bring together individuals from diverse backgrounds, these spaces create a vibrant and supportive environment.</p><p>In coliving spaces, residents have their own private rooms while sharing common areas such as kitchens, lounges, and recreational spaces.&nbsp;</p><p>In addition to the social aspect, co-living spaces prioritize the safety and well-being of their residents. They provide secure and comfortable havens for both men and women. Ladies hostels in cv ramanagarar within these coliving spaces ensure a secure and comfortable environment exclusively designed for women, prioritizing their safety and offering a welcoming atmosphere.</p><p>For those seeking privacy and convenience, a single-room hostels in cv ramanagarar Bangalore is the perfect choice. These accommodations offer a dedicated living space where residents can enjoy their personal sphere without the need to share rooms or bathrooms with roommates. In <a href='https://zolostays.com/single-room-for-rent-in-bangalore' rel='noopener noreferrer' target='_blank' style='color: var(--intergalactic-text-link, #006dca);'>single-room hostels</a>, you have the luxury of having your own private space, ensuring that you don't have to compromise or negotiate with roommates. With no roommates to consider, you can enjoy the freedom and comfort of living according to your preferences and schedule.</p>"
