url,shortDescription
hostels-in-cv_ramanagar-bangalore,"<p>HOSTELS in cv ramanagar is a good option for Bangalore people. Offering single, double, and triple sharing rooms, premium accommodations by Zolo also provide an array of services which are inclusive of homely meals, daily housekeeping, WiFi, DTH, and much more. We have single, double, and private occupancy hostels in cv ramanagar, <a href='https://zolostays.com/pgs-in-bangalore' rel='noopener noreferrer' target='_blank' style='color: var(--intergalactic-text-link, #006dca);'>Bangalore</a>, And what's more, it acts as a savior for men/women working/studying in and around top-notch IT companies. Hurry Book your stay today!</p><p>Are you looking for the best hostels in cv ramanagar Bangalore? Embarking on this task can be challenging as it requires careful consideration of factors such as budget and other essential aspects to find your ideal living space. Gone are the days when you needed a broker to search for a house. </p><p>In today's era, finding a suitable living space has become easier with platforms like Zolostays. Whether you're looking for a coliving hostels in cv ramanagar or any other area, Zolo has got you covered.</p><p>When searching for a <a href='https://zolostays.com/women-pgs-in-bangalore' rel='noopener noreferrer' target='_blank' style='color: var(--intergalactic-text-link, #006dca);'>hostels for ladies</a> in cv ramanagar, the priorities that come to mind are safety and comfort. Ensuring a secure and welcoming environment for female residents is of utmost importance in these accommodations. On the other hand, when it comes to a luxury <a href='https://zolostays.com/men-pgs-in-bangalore' rel='noopener noreferrer' target='_blank' style='color: var(--intergalactic-text-link, #006dca);'>hostels for gents</a> in cv ramanagar Bangalore, the primary concern is a worry-free stay after that comfort, and sophistication come into place.&nbsp;</p><p>Zolo's accommodations are dedicated to offering male residents a hassle-free living experience. They prioritize convenience and peace of mind by providing features such as controlled access, round-the-clock security, and attentive staff members who are ready to assist.</p><p>In addition, the Luxury hostels in cv ramanagar surpasses ordinary expectations, elevating the living experience to new heights. Residents have access to a variety of amenities and services included in their rent, making their stay truly exceptional.</p><p>With Zolo's hassle-free hostels in cv ramanagar, residents can enjoy a seamless and comfortable living experience, where their needs are catered to and their concerns are taken care of. Thoughtful planning provides everything from top-notch security to luxurious amenities to enhance the overall quality of life.</p><p>Unisex hostels in cv ramanagar is designed to cater to the diverse needs of both students and working professionals. These accommodations create an inclusive environment where individuals from different backgrounds can coexist. Recognizing that some students may prefer an environment that is exclusively focused on their needs, there are options available that cater specifically to students. Zolo's student hostels accommodation in cv ramanagar is tailored to meet the requirements and preferences of students, ensuring a supportive and conducive environment for their academic pursuits.</p><p>Coliving Spaces in cv ramanagar embrace Community Living as it offers a unique living concept that fosters community and collaboration. Designed to bring together individuals from diverse backgrounds, these spaces create a vibrant and supportive environment.</p><p>In coliving spaces, residents have their own private rooms while sharing common areas such as kitchens, lounges, and recreational spaces.&nbsp;</p><p>In addition to the social aspect, co-living spaces prioritize the safety and well-being of their residents. They provide secure and comfortable havens for both men and women. Ladies hostels in cv ramanagar within these coliving spaces ensure a secure and comfortable environment exclusively designed for women, prioritizing their safety and offering a welcoming atmosphere.</p><p>For those seeking privacy and convenience, a single-room hostels in cv ramanagar Bangalore is the perfect choice. These accommodations offer a dedicated living space where residents can enjoy their personal sphere without the need to share rooms or bathrooms with roommates. In <a href='https://zolostays.com/single-room-for-rent-in-bangalore' rel='noopener noreferrer' target='_blank' style='color: var(--intergalactic-text-link, #006dca);'>single-room hostels</a>, you have the luxury of having your own private space, ensuring that you don't have to compromise or negotiate with roommates. With no roommates to consider, you can enjoy the freedom and comfort of living according to your preferences and schedule.</p>"
pgs-in-maraimalai_nagar-chennai,"<p>For those in Chennai, the PGS accommodations in maraimalai nagar offer a positive and advantageous choice. It's a beneficial option for people residing in the city seeking accommodation. Offering single, double, and triple sharing rooms, premium accommodations by Zolo also provide an array of services which are inclusive of homely meals, daily housekeeping, WiFi, DTH, and much more. We have single, double, and private occupancy pgs in maraimalai nagar, <a href='https://zolostays.com/pgs-in-chennai' rel='noopener noreferrer' target='_blank' style='color: var(--intergalactic-text-link, #006dca);'>Chennai</a>, And what's more, it acts as a savior for men/women working/studying in and around top-notch IT companies. Hurry Book your stay today!</p><p>Are you looking for the best pgs in maraimalai nagar Chennai? Embarking on this task can be challenging as it requires careful consideration of factors such as budget and other essential aspects to find your ideal living space. Gone are the days when you needed a broker to search for a house. </p><p>In today's era, finding a suitable living space has become easier with platforms like Zolostays. Whether you're looking for a coliving pgs in maraimalai nagar or any other area, Zolo has got you covered.</p><p>When searching for a <a href='https://zolostays.com/women-pgs-in-chennai' rel='noopener noreferrer' target='_blank' style='color: var(--intergalactic-text-link, #006dca);'>pgs for ladies</a> in maraimalai nagar, the priorities that come to mind are safety and comfort. Ensuring a secure and welcoming environment for female residents is of utmost importance in these accommodations. On the other hand, when it comes to a luxury <a href='https://zolostays.com/men-pgs-in-chennai' rel='noopener noreferrer' target='_blank' style='color: var(--intergalactic-text-link, #006dca);'>pgs for gents</a> in maraimalai nagar Chennai, the primary concern is a worry-free stay after that comfort, and sophistication come into place.&nbsp;</p><p>Zolo's accommodations are dedicated to offering male residents a hassle-free living experience. They prioritize convenience and peace of mind by providing features such as controlled access, round-the-clock security, and attentive staff members who are ready to assist.</p><p>In addition, the Luxury pgs in maraimalai nagar surpasses ordinary expectations, elevating the living experience to new heights. Residents have access to a variety of amenities and services included in their rent, making their stay truly exceptional.</p><p>With Zolo's hassle-free pgs in maraimalai nagar, residents can enjoy a seamless and comfortable living experience, where their needs are catered to and their concerns are taken care of. Thoughtful planning provides everything from top-notch security to luxurious amenities to enhance the overall quality of life.</p><p>Unisex pgs in maraimalai nagar is designed to cater to the diverse needs of both students and working professionals. These accommodations create an inclusive environment where individuals from different backgrounds can coexist. Recognizing that some students may prefer an environment that is exclusively focused on their needs, there are options available that cater specifically to students. Zolo's student pgs accommodation in maraimalai nagar is tailored to meet the requirements and preferences of students, ensuring a supportive and conducive environment for their academic pursuits.</p><p>Coliving Spaces in maraimalai nagar embrace Community Living as it offers a unique living concept that fosters community and collaboration. Designed to bring together individuals from diverse backgrounds, these spaces create a vibrant and supportive environment.</p><p>In coliving spaces, residents have their own private rooms while sharing common areas such as kitchens, lounges, and recreational spaces.&nbsp;</p><p>In addition to the social aspect, co-living spaces prioritize the safety and well-being of their residents. They provide secure and comfortable havens for both men and women. Ladies pgs in maraimalai nagar within these coliving spaces ensure a secure and comfortable environment exclusively designed for women, prioritizing their safety and offering a welcoming atmosphere.</p><p>For those seeking privacy and convenience, a single-room pgs in maraimalai nagar Chennai is the perfect choice. These accommodations offer a dedicated living space where residents can enjoy their personal sphere without the need to share rooms or bathrooms with roommates. In <a href='https://zolostays.com/single-room-for-rent-in-chennai' rel='noopener noreferrer' target='_blank' style='color: var(--intergalactic-text-link, #006dca);'>single-room pgs</a>, you have the luxury of having your own private space, ensuring that you don't have to compromise or negotiate with roommates. With no roommates to consider, you can enjoy the freedom and comfort of living according to your preferences and schedule.</p>"
hostels-in-karvenagar-pune,"<p>For those in Pune, the HOSTELS accommodations in karvenagar offer a positive and advantageous choice. It's a beneficial option for people residing in the city seeking accommodation. Offering single, double, and triple sharing rooms, premium accommodations by Zolo also provide an array of services which are inclusive of homely meals, daily housekeeping, WiFi, DTH, and much more. We have single, double, and private occupancy hostels in karvenagar, <a href='https://zolostays.com/pgs-in-pune' rel='noopener noreferrer' target='_blank' style='color: var(--intergalactic-text-link, #006dca);'>Pune</a>, And what's more, it acts as a savior for men/women working/studying in and around top-notch IT companies. Hurry Book your stay today!</p><p>Are you looking for the best hostels in karvenagar Pune? Embarking on this task can be challenging as it requires careful consideration of factors such as budget and other essential aspects to find your ideal living space. Gone are the days when you needed a broker to search for a house. </p><p>In today's era, finding a suitable living space has become easier with platforms like Zolostays. Whether you're looking for a coliving hostels in karvenagar or any other area, Zolo has got you covered.</p><p>When searching for a <a href='https://zolostays.com/women-pgs-in-pune' rel='noopener noreferrer' target='_blank' style='color: var(--intergalactic-text-link, #006dca);'>hostels for ladies</a> in karvenagar, the priorities that come to mind are safety and comfort. Ensuring a secure and welcoming environment for female residents is of utmost importance in these accommodations. On the other hand, when it comes to a luxury <a href='https://zolostays.com/men-pgs-in-pune' rel='noopener noreferrer' target='_blank' style='color: var(--intergalactic-text-link, #006dca);'>hostels for gents</a> in karvenagar Pune, the primary concern is a worry-free stay after that comfort, and sophistication come into place.&nbsp;</p><p>Zolo's accommodations are dedicated to offering male residents a hassle-free living experience. They prioritize convenience and peace of mind by providing features such as controlled access, round-the-clock security, and attentive staff members who are ready to assist.</p><p>In addition, the Luxury hostels in karvenagar surpasses ordinary expectations, elevating the living experience to new heights. Residents have access to a variety of amenities and services included in their rent, making their stay truly exceptional.</p><p>With Zolo's hassle-free hostels in karvenagar, residents can enjoy a seamless and comfortable living experience, where their needs are catered to and their concerns are taken care of. Thoughtful planning provides everything from top-notch security to luxurious amenities to enhance the overall quality of life.</p><p>Unisex hostels in karvenagar is designed to cater to the diverse needs of both students and working professionals. These accommodations create an inclusive environment where individuals from different backgrounds can coexist. Recognizing that some students may prefer an environment that is exclusively focused on their needs, there are options available that cater specifically to students. Zolo's student hostels accommodation in karvenagar is tailored to meet the requirements and preferences of students, ensuring a supportive and conducive environment for their academic pursuits.</p><p>Coliving Spaces in karvenagar embrace Community Living as it offers a unique living concept that fosters community and collaboration. Designed to bring together individuals from diverse backgrounds, these spaces create a vibrant and supportive environment.</p><p>In coliving spaces, residents have their own private rooms while sharing common areas such as kitchens, lounges, and recreational spaces.&nbsp;</p><p>In addition to the social aspect, co-living spaces prioritize the safety and well-being of their residents. They provide secure and comfortable havens for both men and women. Ladies hostels in karvenagar within these coliving spaces ensure a secure and comfortable environment exclusively designed for women, prioritizing their safety and offering a welcoming atmosphere.</p><p>For those seeking privacy and convenience, a single-room hostels in karvenagar Pune is the perfect choice. These accommodations offer a dedicated living space where residents can enjoy their personal sphere without the need to share rooms or bathrooms with roommates. In <a href='https://zolostays.com/single-room-for-rent-in-pune' rel='noopener noreferrer' target='_blank' style='color: var(--intergalactic-text-link, #006dca);'>single-room hostels</a>, you have the luxury of having your own private space, ensuring that you don't have to compromise or negotiate with roommates. With no roommates to consider, you can enjoy the freedom and comfort of living according to your preferences and schedule.</p>"
hostels-in-landmark_city-kota,"<p>For those in Kota, the HOSTELS accommodations in landmark city offer a positive and advantageous choice. It's a beneficial option for people residing in the city seeking accommodation. Offering single, double, and triple sharing rooms, premium accommodations by Zolo also provide an array of services which are inclusive of homely meals, daily housekeeping, WiFi, DTH, and much more. We have single, double, and private occupancy hostels in landmark city, <a href='https://zolostays.com/pgs-in-kota' rel='noopener noreferrer' target='_blank' style='color: var(--intergalactic-text-link, #006dca);'>Kota</a>, And what's more, it acts as a savior for men/women working/studying in and around top-notch IT companies. Hurry Book your stay today!</p><p>Are you looking for the best hostels in landmark city Kota? Embarking on this task can be challenging as it requires careful consideration of factors such as budget and other essential aspects to find your ideal living space. Gone are the days when you needed a broker to search for a house. </p><p>In today's era, finding a suitable living space has become easier with platforms like Zolostays. Whether you're looking for a coliving hostels in landmark city or any other area, Zolo has got you covered.</p><p>When searching for a <a href='https://zolostays.com/women-pgs-in-kota' rel='noopener noreferrer' target='_blank' style='color: var(--intergalactic-text-link, #006dca);'>hostels for ladies</a> in landmark city, the priorities that come to mind are safety and comfort. Ensuring a secure and welcoming environment for female residents is of utmost importance in these accommodations. On the other hand, when it comes to a luxury <a href='https://zolostays.com/men-pgs-in-kota' rel='noopener noreferrer' target='_blank' style='color: var(--intergalactic-text-link, #006dca);'>hostels for gents</a> in landmark city Kota, the primary concern is a worry-free stay after that comfort, and sophistication come into place.&nbsp;</p><p>Zolo's accommodations are dedicated to offering male residents a hassle-free living experience. They prioritize convenience and peace of mind by providing features such as controlled access, round-the-clock security, and attentive staff members who are ready to assist.</p><p>In addition, the Luxury hostels in landmark city surpasses ordinary expectations, elevating the living experience to new heights. Residents have access to a variety of amenities and services included in their rent, making their stay truly exceptional.</p><p>With Zolo's hassle-free hostels in landmark city, residents can enjoy a seamless and comfortable living experience, where their needs are catered to and their concerns are taken care of. Thoughtful planning provides everything from top-notch security to luxurious amenities to enhance the overall quality of life.</p><p>Unisex hostels in landmark city is designed to cater to the diverse needs of both students and working professionals. These accommodations create an inclusive environment where individuals from different backgrounds can coexist. Recognizing that some students may prefer an environment that is exclusively focused on their needs, there are options available that cater specifically to students. Zolo's student hostels accommodation in landmark city is tailored to meet the requirements and preferences of students, ensuring a supportive and conducive environment for their academic pursuits.</p><p>Coliving Spaces in landmark city embrace Community Living as it offers a unique living concept that fosters community and collaboration. Designed to bring together individuals from diverse backgrounds, these spaces create a vibrant and supportive environment.</p><p>In coliving spaces, residents have their own private rooms while sharing common areas such as kitchens, lounges, and recreational spaces.&nbsp;</p><p>In addition to the social aspect, co-living spaces prioritize the safety and well-being of their residents. They provide secure and comfortable havens for both men and women. Ladies hostels in landmark city within these coliving spaces ensure a secure and comfortable environment exclusively designed for women, prioritizing their safety and offering a welcoming atmosphere.</p><p>For those seeking privacy and convenience, a single-room hostels in landmark city Kota is the perfect choice. These accommodations offer a dedicated living space where residents can enjoy their personal sphere without the need to share rooms or bathrooms with roommates. In <a href='https://zolostays.com/single-room-for-rent-in-kota' rel='noopener noreferrer' target='_blank' style='color: var(--intergalactic-text-link, #006dca);'>single-room hostels</a>, you have the luxury of having your own private space, ensuring that you don't have to compromise or negotiate with roommates. With no roommates to consider, you can enjoy the freedom and comfort of living according to your preferences and schedule.</p>"
hostels-in-jb_nagar_andheri-mumbai,"<p>HOSTELS in jb nagar andheri is a good option for Mumbai people. Offering single, double, and triple sharing rooms, premium accommodations by Zolo also provide an array of services which are inclusive of homely meals, daily housekeeping, WiFi, DTH, and much more. We have single, double, and private occupancy hostels in jb nagar andheri, <a href='https://zolostays.com/pgs-in-mumbai' rel='noopener noreferrer' target='_blank' style='color: var(--intergalactic-text-link, #006dca);'>Mumbai</a>, And what's more, it acts as a savior for men/women working/studying in and around top-notch IT companies. Hurry Book your stay today!</p><p>Are you looking for the best hostels in jb nagar andheri Mumbai? Embarking on this task can be challenging as it requires careful consideration of factors such as budget and other essential aspects to find your ideal living space. Gone are the days when you needed a broker to search for a house. </p><p>In today's era, finding a suitable living space has become easier with platforms like Zolostays. Whether you're looking for a coliving hostels in jb nagar andheri or any other area, Zolo has got you covered.</p><p>When searching for a <a href='https://zolostays.com/women-pgs-in-mumbai' rel='noopener noreferrer' target='_blank' style='color: var(--intergalactic-text-link, #006dca);'>hostels for ladies</a> in jb nagar andheri, the priorities that come to mind are safety and comfort. Ensuring a secure and welcoming environment for female residents is of utmost importance in these accommodations. On the other hand, when it comes to a luxury <a href='https://zolostays.com/men-pgs-in-mumbai' rel='noopener noreferrer' target='_blank' style='color: var(--intergalactic-text-link, #006dca);'>hostels for gents</a> in jb nagar andheri Mumbai, the primary concern is a worry-free stay after that comfort, and sophistication come into place.&nbsp;</p><p>Zolo's accommodations are dedicated to offering male residents a hassle-free living experience. They prioritize convenience and peace of mind by providing features such as controlled access, round-the-clock security, and attentive staff members who are ready to assist.</p><p>In addition, the Luxury hostels in jb nagar andheri surpasses ordinary expectations, elevating the living experience to new heights. Residents have access to a variety of amenities and services included in their rent, making their stay truly exceptional.</p><p>With Zolo's hassle-free hostels in jb nagar andheri, residents can enjoy a seamless and comfortable living experience, where their needs are catered to and their concerns are taken care of. Thoughtful planning provides everything from top-notch security to luxurious amenities to enhance the overall quality of life.</p><p>Unisex hostels in jb nagar andheri is designed to cater to the diverse needs of both students and working professionals. These accommodations create an inclusive environment where individuals from different backgrounds can coexist. Recognizing that some students may prefer an environment that is exclusively focused on their needs, there are options available that cater specifically to students. Zolo's student hostels accommodation in jb nagar andheri is tailored to meet the requirements and preferences of students, ensuring a supportive and conducive environment for their academic pursuits.</p><p>Coliving Spaces in jb nagar andheri embrace Community Living as it offers a unique living concept that fosters community and collaboration. Designed to bring together individuals from diverse backgrounds, these spaces create a vibrant and supportive environment.</p><p>In coliving spaces, residents have their own private rooms while sharing common areas such as kitchens, lounges, and recreational spaces.&nbsp;</p><p>In addition to the social aspect, co-living spaces prioritize the safety and well-being of their residents. They provide secure and comfortable havens for both men and women. Ladies hostels in jb nagar andheri within these coliving spaces ensure a secure and comfortable environment exclusively designed for women, prioritizing their safety and offering a welcoming atmosphere.</p><p>For those seeking privacy and convenience, a single-room hostels in jb nagar andheri Mumbai is the perfect choice. These accommodations offer a dedicated living space where residents can enjoy their personal sphere without the need to share rooms or bathrooms with roommates. In <a href='https://zolostays.com/single-room-for-rent-in-mumbai' rel='noopener noreferrer' target='_blank' style='color: var(--intergalactic-text-link, #006dca);'>single-room hostels</a>, you have the luxury of having your own private space, ensuring that you don't have to compromise or negotiate with roommates. With no roommates to consider, you can enjoy the freedom and comfort of living according to your preferences and schedule.</p>"
