url,shortDescription
hostels-in-radha_reddy_layoutroad-bangalore,"<p>For those in Bangalore, the HOSTELS accommodations in radha reddy layoutroad offer a positive and advantageous choice. It's a beneficial option for people residing in the city seeking accommodation. Offering single, double, and triple sharing rooms, premium accommodations by Zolo also provide an array of services which are inclusive of homely meals, daily housekeeping, WiFi, DTH, and much more. We have single, double, and private occupancy hostels in radha reddy layoutroad, <a href='https://zolostays.com/pgs-in-bangalore' rel='noopener noreferrer' target='_blank' style='color: var(--intergalactic-text-link, #006dca);'>Bangalore</a>, And what's more, it acts as a savior for men/women working/studying in and around top-notch IT companies. Hurry Book your stay today!</p><p>Are you looking for the best hostels in radha reddy layoutroad Bangalore? Embarking on this task can be challenging as it requires careful consideration of factors such as budget and other essential aspects to find your ideal living space. Gone are the days when you needed a broker to search for a house. </p><p>In today's era, finding a suitable living space has become easier with platforms like Zolostays. Whether you're looking for a coliving hostels in radha reddy layoutroad or any other area, Zolo has got you covered.</p><p>When searching for a <a href='https://zolostays.com/women-pgs-in-bangalore' rel='noopener noreferrer' target='_blank' style='color: var(--intergalactic-text-link, #006dca);'>hostels for ladies</a> in radha reddy layoutroad, the priorities that come to mind are safety and comfort. Ensuring a secure and welcoming environment for female residents is of utmost importance in these accommodations. On the other hand, when it comes to a luxury <a href='https://zolostays.com/men-pgs-in-bangalore' rel='noopener noreferrer' target='_blank' style='color: var(--intergalactic-text-link, #006dca);'>hostels for gents</a> in radha reddy layoutroad Bangalore, the primary concern is a worry-free stay after that comfort, and sophistication come into place.&nbsp;</p><p>Zolo's accommodations are dedicated to offering male residents a hassle-free living experience. They prioritize convenience and peace of mind by providing features such as controlled access, round-the-clock security, and attentive staff members who are ready to assist.</p><p>In addition, the Luxury hostels in radha reddy layoutroad surpasses ordinary expectations, elevating the living experience to new heights. Residents have access to a variety of amenities and services included in their rent, making their stay truly exceptional.</p><p>With Zolo's hassle-free hostels in radha reddy layoutroad, residents can enjoy a seamless and comfortable living experience, where their needs are catered to and their concerns are taken care of. Thoughtful planning provides everything from top-notch security to luxurious amenities to enhance the overall quality of life.</p><p>Unisex hostels in radha reddy layoutroad is designed to cater to the diverse needs of both students and working professionals. These accommodations create an inclusive environment where individuals from different backgrounds can coexist. Recognizing that some students may prefer an environment that is exclusively focused on their needs, there are options available that cater specifically to students. Zolo's student hostels accommodation in radha reddy layoutroad is tailored to meet the requirements and preferences of students, ensuring a supportive and conducive environment for their academic pursuits.</p><p>Coliving Spaces in radha reddy layoutroad embrace Community Living as it offers a unique living concept that fosters community and collaboration. Designed to bring together individuals from diverse backgrounds, these spaces create a vibrant and supportive environment.</p><p>In coliving spaces, residents have their own private rooms while sharing common areas such as kitchens, lounges, and recreational spaces.&nbsp;</p><p>In addition to the social aspect, co-living spaces prioritize the safety and well-being of their residents. They provide secure and comfortable havens for both men and women. Ladies hostels in radha reddy layoutroad within these coliving spaces ensure a secure and comfortable environment exclusively designed for women, prioritizing their safety and offering a welcoming atmosphere.</p><p>For those seeking privacy and convenience, a single-room hostels in radha reddy layoutroad Bangalore is the perfect choice. These accommodations offer a dedicated living space where residents can enjoy their personal sphere without the need to share rooms or bathrooms with roommates. In <a href='https://zolostays.com/single-room-for-rent-in-bangalore' rel='noopener noreferrer' target='_blank' style='color: var(--intergalactic-text-link, #006dca);'>single-room hostels</a>, you have the luxury of having your own private space, ensuring that you don't have to compromise or negotiate with roommates. With no roommates to consider, you can enjoy the freedom and comfort of living according to your preferences and schedule.</p>"
hostels-in-uppilipalayam-coimbatore,"<p>For those in Coimbatore, the HOSTELS accommodations in uppilipalayam offer a positive and advantageous choice. It's a beneficial option for people residing in the city seeking accommodation. Offering single, double, and triple sharing rooms, premium accommodations by Zolo also provide an array of services which are inclusive of homely meals, daily housekeeping, WiFi, DTH, and much more. We have single, double, and private occupancy hostels in uppilipalayam, <a href='https://zolostays.com/pgs-in-coimbatore' rel='noopener noreferrer' target='_blank' style='color: var(--intergalactic-text-link, #006dca);'>Coimbatore</a>, And what's more, it acts as a savior for men/women working/studying in and around top-notch IT companies. Hurry Book your stay today!</p><p>Are you looking for the best hostels in uppilipalayam Coimbatore? Embarking on this task can be challenging as it requires careful consideration of factors such as budget and other essential aspects to find your ideal living space. Gone are the days when you needed a broker to search for a house. </p><p>In today's era, finding a suitable living space has become easier with platforms like Zolostays. Whether you're looking for a coliving hostels in uppilipalayam or any other area, Zolo has got you covered.</p><p>When searching for a <a href='https://zolostays.com/women-pgs-in-coimbatore' rel='noopener noreferrer' target='_blank' style='color: var(--intergalactic-text-link, #006dca);'>hostels for ladies</a> in uppilipalayam, the priorities that come to mind are safety and comfort. Ensuring a secure and welcoming environment for female residents is of utmost importance in these accommodations. On the other hand, when it comes to a luxury <a href='https://zolostays.com/men-pgs-in-coimbatore' rel='noopener noreferrer' target='_blank' style='color: var(--intergalactic-text-link, #006dca);'>hostels for gents</a> in uppilipalayam Coimbatore, the primary concern is a worry-free stay after that comfort, and sophistication come into place.&nbsp;</p><p>Zolo's accommodations are dedicated to offering male residents a hassle-free living experience. They prioritize convenience and peace of mind by providing features such as controlled access, round-the-clock security, and attentive staff members who are ready to assist.</p><p>In addition, the Luxury hostels in uppilipalayam surpasses ordinary expectations, elevating the living experience to new heights. Residents have access to a variety of amenities and services included in their rent, making their stay truly exceptional.</p><p>With Zolo's hassle-free hostels in uppilipalayam, residents can enjoy a seamless and comfortable living experience, where their needs are catered to and their concerns are taken care of. Thoughtful planning provides everything from top-notch security to luxurious amenities to enhance the overall quality of life.</p><p>Unisex hostels in uppilipalayam is designed to cater to the diverse needs of both students and working professionals. These accommodations create an inclusive environment where individuals from different backgrounds can coexist. Recognizing that some students may prefer an environment that is exclusively focused on their needs, there are options available that cater specifically to students. Zolo's student hostels accommodation in uppilipalayam is tailored to meet the requirements and preferences of students, ensuring a supportive and conducive environment for their academic pursuits.</p><p>Coliving Spaces in uppilipalayam embrace Community Living as it offers a unique living concept that fosters community and collaboration. Designed to bring together individuals from diverse backgrounds, these spaces create a vibrant and supportive environment.</p><p>In coliving spaces, residents have their own private rooms while sharing common areas such as kitchens, lounges, and recreational spaces.&nbsp;</p><p>In addition to the social aspect, co-living spaces prioritize the safety and well-being of their residents. They provide secure and comfortable havens for both men and women. Ladies hostels in uppilipalayam within these coliving spaces ensure a secure and comfortable environment exclusively designed for women, prioritizing their safety and offering a welcoming atmosphere.</p><p>For those seeking privacy and convenience, a single-room hostels in uppilipalayam Coimbatore is the perfect choice. These accommodations offer a dedicated living space where residents can enjoy their personal sphere without the need to share rooms or bathrooms with roommates. In <a href='https://zolostays.com/single-room-for-rent-in-coimbatore' rel='noopener noreferrer' target='_blank' style='color: var(--intergalactic-text-link, #006dca);'>single-room hostels</a>, you have the luxury of having your own private space, ensuring that you don't have to compromise or negotiate with roommates. With no roommates to consider, you can enjoy the freedom and comfort of living according to your preferences and schedule.</p>"
hostels-in-sowbakiya_nagar-coimbatore,"<p>Opting for accommodation in sowbakiya nagar's HOSTELS facilities proves advantageous for residents of Coimbatore. The HOSTELS in sowbakiya nagar stand out as a favorable choice for those seeking housing in Coimbatore due to its positive attributes. Residents in Coimbatore find the HOSTELS in sowbakiya nagar to be a commendable option for their accommodation needs. Offering single, double, and triple sharing rooms, premium accommodations by Zolo also provide an array of services which are inclusive of homely meals, daily housekeeping, WiFi, DTH, and much more. We have single, double, and private occupancy hostels in sowbakiya nagar, <a href='https://zolostays.com/pgs-in-coimbatore' rel='noopener noreferrer' target='_blank' style='color: var(--intergalactic-text-link, #006dca);'>Coimbatore</a>, And what's more, it acts as a savior for men/women working/studying in and around top-notch IT companies. Hurry Book your stay today!</p><p>Are you looking for the best hostels in sowbakiya nagar Coimbatore? Embarking on this task can be challenging as it requires careful consideration of factors such as budget and other essential aspects to find your ideal living space. Gone are the days when you needed a broker to search for a house. </p><p>In today's era, finding a suitable living space has become easier with platforms like Zolostays. Whether you're looking for a coliving hostels in sowbakiya nagar or any other area, Zolo has got you covered.</p><p>When searching for a <a href='https://zolostays.com/women-pgs-in-coimbatore' rel='noopener noreferrer' target='_blank' style='color: var(--intergalactic-text-link, #006dca);'>hostels for ladies</a> in sowbakiya nagar, the priorities that come to mind are safety and comfort. Ensuring a secure and welcoming environment for female residents is of utmost importance in these accommodations. On the other hand, when it comes to a luxury <a href='https://zolostays.com/men-pgs-in-coimbatore' rel='noopener noreferrer' target='_blank' style='color: var(--intergalactic-text-link, #006dca);'>hostels for gents</a> in sowbakiya nagar Coimbatore, the primary concern is a worry-free stay after that comfort, and sophistication come into place.&nbsp;</p><p>Zolo's accommodations are dedicated to offering male residents a hassle-free living experience. They prioritize convenience and peace of mind by providing features such as controlled access, round-the-clock security, and attentive staff members who are ready to assist.</p><p>In addition, the Luxury hostels in sowbakiya nagar surpasses ordinary expectations, elevating the living experience to new heights. Residents have access to a variety of amenities and services included in their rent, making their stay truly exceptional.</p><p>With Zolo's hassle-free hostels in sowbakiya nagar, residents can enjoy a seamless and comfortable living experience, where their needs are catered to and their concerns are taken care of. Thoughtful planning provides everything from top-notch security to luxurious amenities to enhance the overall quality of life.</p><p>Unisex hostels in sowbakiya nagar is designed to cater to the diverse needs of both students and working professionals. These accommodations create an inclusive environment where individuals from different backgrounds can coexist. Recognizing that some students may prefer an environment that is exclusively focused on their needs, there are options available that cater specifically to students. Zolo's student hostels accommodation in sowbakiya nagar is tailored to meet the requirements and preferences of students, ensuring a supportive and conducive environment for their academic pursuits.</p><p>Coliving Spaces in sowbakiya nagar embrace Community Living as it offers a unique living concept that fosters community and collaboration. Designed to bring together individuals from diverse backgrounds, these spaces create a vibrant and supportive environment.</p><p>In coliving spaces, residents have their own private rooms while sharing common areas such as kitchens, lounges, and recreational spaces.&nbsp;</p><p>In addition to the social aspect, co-living spaces prioritize the safety and well-being of their residents. They provide secure and comfortable havens for both men and women. Ladies hostels in sowbakiya nagar within these coliving spaces ensure a secure and comfortable environment exclusively designed for women, prioritizing their safety and offering a welcoming atmosphere.</p><p>For those seeking privacy and convenience, a single-room hostels in sowbakiya nagar Coimbatore is the perfect choice. These accommodations offer a dedicated living space where residents can enjoy their personal sphere without the need to share rooms or bathrooms with roommates. In <a href='https://zolostays.com/single-room-for-rent-in-coimbatore' rel='noopener noreferrer' target='_blank' style='color: var(--intergalactic-text-link, #006dca);'>single-room hostels</a>, you have the luxury of having your own private space, ensuring that you don't have to compromise or negotiate with roommates. With no roommates to consider, you can enjoy the freedom and comfort of living according to your preferences and schedule.</p>"
hostels-in-testtest-coimbatore,"<p>Opting for accommodation in testtest's HOSTELS facilities proves advantageous for residents of Coimbatore. The HOSTELS in testtest stand out as a favorable choice for those seeking housing in Coimbatore due to its positive attributes. Residents in Coimbatore find the HOSTELS in testtest to be a commendable option for their accommodation needs. Offering single, double, and triple sharing rooms, premium accommodations by Zolo also provide an array of services which are inclusive of homely meals, daily housekeeping, WiFi, DTH, and much more. We have single, double, and private occupancy hostels in testtest, <a href='https://zolostays.com/pgs-in-coimbatore' rel='noopener noreferrer' target='_blank' style='color: var(--intergalactic-text-link, #006dca);'>Coimbatore</a>, And what's more, it acts as a savior for men/women working/studying in and around top-notch IT companies. Hurry Book your stay today!</p><p>Are you looking for the best hostels in testtest Coimbatore? Embarking on this task can be challenging as it requires careful consideration of factors such as budget and other essential aspects to find your ideal living space. Gone are the days when you needed a broker to search for a house. </p><p>In today's era, finding a suitable living space has become easier with platforms like Zolostays. Whether you're looking for a coliving hostels in testtest or any other area, Zolo has got you covered.</p><p>When searching for a <a href='https://zolostays.com/women-pgs-in-coimbatore' rel='noopener noreferrer' target='_blank' style='color: var(--intergalactic-text-link, #006dca);'>hostels for ladies</a> in testtest, the priorities that come to mind are safety and comfort. Ensuring a secure and welcoming environment for female residents is of utmost importance in these accommodations. On the other hand, when it comes to a luxury <a href='https://zolostays.com/men-pgs-in-coimbatore' rel='noopener noreferrer' target='_blank' style='color: var(--intergalactic-text-link, #006dca);'>hostels for gents</a> in testtest Coimbatore, the primary concern is a worry-free stay after that comfort, and sophistication come into place.&nbsp;</p><p>Zolo's accommodations are dedicated to offering male residents a hassle-free living experience. They prioritize convenience and peace of mind by providing features such as controlled access, round-the-clock security, and attentive staff members who are ready to assist.</p><p>In addition, the Luxury hostels in testtest surpasses ordinary expectations, elevating the living experience to new heights. Residents have access to a variety of amenities and services included in their rent, making their stay truly exceptional.</p><p>With Zolo's hassle-free hostels in testtest, residents can enjoy a seamless and comfortable living experience, where their needs are catered to and their concerns are taken care of. Thoughtful planning provides everything from top-notch security to luxurious amenities to enhance the overall quality of life.</p><p>Unisex hostels in testtest is designed to cater to the diverse needs of both students and working professionals. These accommodations create an inclusive environment where individuals from different backgrounds can coexist. Recognizing that some students may prefer an environment that is exclusively focused on their needs, there are options available that cater specifically to students. Zolo's student hostels accommodation in testtest is tailored to meet the requirements and preferences of students, ensuring a supportive and conducive environment for their academic pursuits.</p><p>Coliving Spaces in testtest embrace Community Living as it offers a unique living concept that fosters community and collaboration. Designed to bring together individuals from diverse backgrounds, these spaces create a vibrant and supportive environment.</p><p>In coliving spaces, residents have their own private rooms while sharing common areas such as kitchens, lounges, and recreational spaces.&nbsp;</p><p>In addition to the social aspect, co-living spaces prioritize the safety and well-being of their residents. They provide secure and comfortable havens for both men and women. Ladies hostels in testtest within these coliving spaces ensure a secure and comfortable environment exclusively designed for women, prioritizing their safety and offering a welcoming atmosphere.</p><p>For those seeking privacy and convenience, a single-room hostels in testtest Coimbatore is the perfect choice. These accommodations offer a dedicated living space where residents can enjoy their personal sphere without the need to share rooms or bathrooms with roommates. In <a href='https://zolostays.com/single-room-for-rent-in-coimbatore' rel='noopener noreferrer' target='_blank' style='color: var(--intergalactic-text-link, #006dca);'>single-room hostels</a>, you have the luxury of having your own private space, ensuring that you don't have to compromise or negotiate with roommates. With no roommates to consider, you can enjoy the freedom and comfort of living according to your preferences and schedule.</p>"
hostels-in-gowlidoddi-hyderabad,"<p>HOSTELS in gowlidoddi is a good option for Hyderabad people. Offering single, double, and triple sharing rooms, premium accommodations by Zolo also provide an array of services which are inclusive of homely meals, daily housekeeping, WiFi, DTH, and much more. We have single, double, and private occupancy hostels in gowlidoddi, <a href='https://zolostays.com/pgs-in-hyderabad' rel='noopener noreferrer' target='_blank' style='color: var(--intergalactic-text-link, #006dca);'>Hyderabad</a>, And what's more, it acts as a savior for men/women working/studying in and around top-notch IT companies. Hurry Book your stay today!</p><p>Are you looking for the best hostels in gowlidoddi Hyderabad? Embarking on this task can be challenging as it requires careful consideration of factors such as budget and other essential aspects to find your ideal living space. Gone are the days when you needed a broker to search for a house. </p><p>In today's era, finding a suitable living space has become easier with platforms like Zolostays. Whether you're looking for a coliving hostels in gowlidoddi or any other area, Zolo has got you covered.</p><p>When searching for a <a href='https://zolostays.com/women-pgs-in-hyderabad' rel='noopener noreferrer' target='_blank' style='color: var(--intergalactic-text-link, #006dca);'>hostels for ladies</a> in gowlidoddi, the priorities that come to mind are safety and comfort. Ensuring a secure and welcoming environment for female residents is of utmost importance in these accommodations. On the other hand, when it comes to a luxury <a href='https://zolostays.com/men-pgs-in-hyderabad' rel='noopener noreferrer' target='_blank' style='color: var(--intergalactic-text-link, #006dca);'>hostels for gents</a> in gowlidoddi Hyderabad, the primary concern is a worry-free stay after that comfort, and sophistication come into place.&nbsp;</p><p>Zolo's accommodations are dedicated to offering male residents a hassle-free living experience. They prioritize convenience and peace of mind by providing features such as controlled access, round-the-clock security, and attentive staff members who are ready to assist.</p><p>In addition, the Luxury hostels in gowlidoddi surpasses ordinary expectations, elevating the living experience to new heights. Residents have access to a variety of amenities and services included in their rent, making their stay truly exceptional.</p><p>With Zolo's hassle-free hostels in gowlidoddi, residents can enjoy a seamless and comfortable living experience, where their needs are catered to and their concerns are taken care of. Thoughtful planning provides everything from top-notch security to luxurious amenities to enhance the overall quality of life.</p><p>Unisex hostels in gowlidoddi is designed to cater to the diverse needs of both students and working professionals. These accommodations create an inclusive environment where individuals from different backgrounds can coexist. Recognizing that some students may prefer an environment that is exclusively focused on their needs, there are options available that cater specifically to students. Zolo's student hostels accommodation in gowlidoddi is tailored to meet the requirements and preferences of students, ensuring a supportive and conducive environment for their academic pursuits.</p><p>Coliving Spaces in gowlidoddi embrace Community Living as it offers a unique living concept that fosters community and collaboration. Designed to bring together individuals from diverse backgrounds, these spaces create a vibrant and supportive environment.</p><p>In coliving spaces, residents have their own private rooms while sharing common areas such as kitchens, lounges, and recreational spaces.&nbsp;</p><p>In addition to the social aspect, co-living spaces prioritize the safety and well-being of their residents. They provide secure and comfortable havens for both men and women. Ladies hostels in gowlidoddi within these coliving spaces ensure a secure and comfortable environment exclusively designed for women, prioritizing their safety and offering a welcoming atmosphere.</p><p>For those seeking privacy and convenience, a single-room hostels in gowlidoddi Hyderabad is the perfect choice. These accommodations offer a dedicated living space where residents can enjoy their personal sphere without the need to share rooms or bathrooms with roommates. In <a href='https://zolostays.com/single-room-for-rent-in-hyderabad' rel='noopener noreferrer' target='_blank' style='color: var(--intergalactic-text-link, #006dca);'>single-room hostels</a>, you have the luxury of having your own private space, ensuring that you don't have to compromise or negotiate with roommates. With no roommates to consider, you can enjoy the freedom and comfort of living according to your preferences and schedule.</p>"
